{
  "smartlink_id": "spring_sale_2026",
  "name": "Spring Sale 2026",
  "description": "Unified smartlink for Spring 2026 campaign across TikTok, email, and paid ads channels.",
  "status": "active",
  "targets": [
    {
      "target_id": "de_tiktok_mobile",
      "url": "https://example.de/spring/mobile-funnel?utm_content=tiktok_special",
      "label": "Germany TikTok Mobile Funnel",
      "conditions": {
        "country": "DE",
        "device": "mobile",
        "utm": {
          "source": "tiktok"
        }
      },
      "priority": 10,
      "enabled": true
    },
    {
      "target_id": "email_spring_main",
      "url": "https://example.com/spring/email-landing",
      "label": "Email Campaign Landing Page",
      "conditions": {
        "utm": {
          "source": "email",
          "campaign": "spring_2026"
        }
      },
      "priority": 20,
      "enabled": true
    },
    {
      "target_id": "de_default",
      "url": "https://example.de/spring/main",
      "label": "Germany Default Landing",
      "conditions": {
        "country": "DE"
      },
      "priority": 30,
      "enabled": true
    },
    {
      "target_id": "mobile_general",
      "url": "https://example.com/spring/mobile",
      "label": "Mobile-optimized Landing",
      "conditions": {
        "device": "mobile"
      },
      "priority": 40,
      "enabled": true
    },
    {
      "target_id": "global_fallback",
      "url": "https://example.com/spring/global-en",
      "label": "Global English Landing",
      "conditions": {},
      "priority": 100,
      "enabled": true
    }
  ],
  "default_target_id": "global_fallback",
  "limits": {
    "valid_from": "2026-03-01T00:00:00Z",
    "valid_until": "2026-05-31T23:59:59Z"
  },
  "tags": [
    "spring-2026",
    "seasonal-campaign",
    "multi-channel"
  ],
  "notes": "Main smartlink for Spring 2026 promotional campaign. Monitor TikTok mobile performance closely.",
  "meta": {
    "version": 3,
    "created_at": "2025-11-25T11:37:34Z",
    "updated_at": "2025-12-02T10:15:00Z",
    "created_by": "marketing-team",
    "updated_by": "system-migration-mova4"
  }
}
